filename,duration,flag,transcription
sama_nbl_10h04jun2021_0028.wav,6.4,N,uthi ululekwe  ukungaveli phambi kwekomidi ngombana iphenywe emnyangwenakhe
sama_nbl_10h04jun2021_0029.wav,7.9,N,qalene nendoda ebekwe icala lobula abantwanabyo abane ulukasi phatjha ugcwetha walokha wabotjhwa ngemva koku
sama_nbl_10h04jun2021_0030.wav,6.7,N,funyana babulewe ngendlini kwabentwana bakhe womnyaka elithoba elikhombe  emhlanu nemithathu ubudala
sama_nbl_10h04jun2021_0031.wav,7.2,N,haphasha[village] sekhukhune ngo [february] unyaka odlulileko
sama_nbl_10h04jun2021_0032.wav,4.9,N,[the alleged girlfriend denied this saying he was a facebook friend]
sama_nbl_10h04jun2023_0001.wav,4.9,N,ukabelo makhasani uthi sele asba ukubuyela emsebenzini ngemva kokuthi asahlelwe
sama_nbl_10h04jun2023_0003.wav,8,N,baphume ngobunengi babo ukuya esilahlweni sakhe kanti upalesa lo bekanebhudango lokuba ngudorhodere ucele uthi
sama_nbl_10h04jun2023_0004.wav,7.9,N,ngephimbo lakadlozi mnisi abatjhayeli beenkoloyi ze [bolt] basabela amaphilo wabo wokulandela isehlakalo so
sama_nbl_10h04jun2023_0005.wav,6.6,N,abe nomthlala wabasolwa upalesa ukatwe bekabulawa nebeka sendleleni etjhinga ekhaya abuya esikolweni
sama_nbl_10h04jun2023_0006.wav,4.8,N,lisiza khulu ngokulwisana nendlala ungadli ngokwaneleko nokutlhayela
sama_nbl_10h04jun2023_0007.wav,8.8,N,ekudleni kwabo kwangamalanga kuyokwenza bona bafunde ngcono esikolweni umnyango wezefundo esifundeni se [free state] uhlome ihlelo lokupha abafundi ukudla
sama_nbl_10h04jun2023_0011.wav,7.2,N,ahlukeneko ngezehlakalo ezidosele ekutheni  kube nengozi ekulu yeentimela epumalanga yesifunda se [odisha india]
sama_nbl_10h04jun2023_0012.wav,6.6,N,kanti lokhu kungezelele nesidlo semini ukuhlonywa kwehleio kulinga ukurarulula umraro wokutlhayela kokudla
sama_nbl_10h04jun2023_0013.wav,6.3,N,ekuyotholwa bafundi ababalelwa ngaphezu kweenkulungwane ezimakhulu amahlanu
sama_nbl_10h04jun2023_0014.wav,6.7,N,abafundi besikolo sesako [secondary school] ekuku la upalesa ebekafunda khona ibanga letjhumi nambili
sama_nbl_10h04jun2023_0015.wav,5.6,N,nakungasenjalo mnyango wezefundo le e [free state] uthi ihlelo lokulethwa kokudla kwabentwana eenkolweni
sama_nbl_10h04jun2023_0016.wav,5.1,N,la kube neentimela ezigijima khulu ezilayitjha abantu eziphuma esiporweni
sama_nbl_10h04jun2023_0018.wav,6.5,N,sayoziphosa phezu kwesinye isitimela esilayitjha ipahla nesinye godu esivela ngemva kwaleso
sama_nbl_10h04jun2023_0019.wav,6.9,N,umokalalo mohale uthi irhubhululo litjengise bona ingasi boke abafundi bona ingasi boke abafundi badla isidlo sekuseni ngaphambi kokufika esikolweni
sama_nbl_10h04jun2023_0020.wav,6.5,N,nokutlhayelelwa zizakhamzimba okuthinta ukukhula kwabantwana emzimbeni usomkhandlu wezefundo uma
sama_nbl_10h04jun2023_0023.wav,8.7,NS,njengombana kukhinyabeza ukufunda namaphilo wabentwana [they didnt tell us whats the problem we didnt even have a meeting at school here]
sama_nbl_10h06may2023_0001.wav,12.1,N,nokuphambana nomthethokambiso we a_n_c kanti iyunivesithi  [nelson] mandela ifinyelele esivumelwaneni nabafundi abatjhagalako ekhampasini egqebeha
sama_nbl_10h06may2023_0002.wav,11.8,N,ezihlobana nezenzelwa zomphakathi unobhala we a_n_c e [north west] u [lewis deremedo] uthi ikhansela lelo lijanyiselwe ukuziphatha kumbi namkha ukudlala ngesimilo ezihlobeni nezenzelo zomphakathi
sama_nbl_10h06may2023_0003.wav,8.8,N,umnyanya lo ubanjwa ngemva kweminyaka ematjhumi alikhomba njengombana ingwenyama u [charles] wesithathu wemnyaka ematjhumi alikhomba nane ubudala
sama_nbl_10h06may2023_0004.wav,5.5,N,lokho ngemva kokuthi kunabantu bengubo ababili abavule
sama_nbl_10h06may2023_0006.wav,5.2,N,ivikeleko ngaphambi komnyanya kokubeka ingwenyama yamangisi u [charles] wesithathu
sama_nbl_10h06may2023_0007.wav,7.6,N,kanti amasewula afrika kufuze azilungiselele obunye ubusika obunzima
sama_nbl_10h06may2023_0008.wav,10.2,N,kukhanya bha asithembisane godu ngesimbi yetjhumi nanye
sama_nbl_10h06may2023_0010.wav,7.9,N,ngemva kokulala ubuthongo bokugcina kwendlovukazi yamangisi u [elisabeth] wesibili umnyanya uyokubanjelwa
sama_nbl_10h06may2023_0011.wav,9,N,kelwa ngemali kwabafundi umkhulumeli weyunivesithi uzandile mbambela uthi abaphathi bayohlangana ne NSFAS
sama_nbl_10h06may2023_0012.wav,5.8,N,kutjho ze awa letjhumi kukwekwezi f_m
sama_nbl_10h06may2023_0017.wav,27.5,NS,isiqunto sayizolo siveze bona ungqongqotjhe wezamabhizinisi wombuso u [pravin gordhan] kufuze athathe amagadango kungakapheli amalanga amatjhumi amahlanu uqinisekisa bona kunegezi eyaneleko ama [generator] nezinye iindlela zegezi ekukhandela ukucima kwegezi emazikweni layo sibikelwa ngukheni maphanga [the interim order came out after the united democratic movement and the other board applications]
sama_nbl_10h06may2023_0019.wav,6.9,N,alindeleke ukubekwa njengengonyama yamangisi phambili kweemvakatjhi eziinkulungwana ezimbili
sama_nbl_10h06may2023_0020.wav,5.3,N,abafundi bangenele iintrada izolo ngebanga leenlilo ezimalungana nokuse
sama_nbl_10h06may2023_0025.wav,6.3,N,iveke ezako sinomvezi ulondiwe masilela sithokoze khulu d_j iintambo ngizitjhiya nawe
sama_nbl_10h06may2023_0026.wav,8.5,N,icala lokutlhoriswa ngokomseme ngelithi ikhansela lelo libabawe umseme ukwenzela ukusizwa ngendaba
sama_nbl_10h06may2023_0028.wav,10.8,N,[solution] [kuleyonto yonke endingathi mina] kanti amalunga wephiko lamajoni we [britain] aziinkulungwana ezihlanu afike e [london] njengombana kuqinisekiswe
sama_nbl_10h08oct2022_0001.wav,9.3,N,undunakulu omutjha we [gauteng] upanyaza lesufi unikele usomkhandlu omutjha wezeemali u [jacob] mamabolo umsebenzi wokuvela nehlelo elizakuqinisekisa ukuthi
sama_nbl_10h08oct2022_0002.wav,7.4,N,abaphenyi bazokusonga iimbiko ekupheleni kwenyanga ephezulu bese idluliselwa kungqongqotjhe wezobulungiswa u [ronald] tlamola 
sama_nbl_10h08oct2022_0003.wav,8.8,N,eh nokutlola kwabo kuthuthuke njalo ke ngithokoza khulu bangani bami lapho emakhaya sizokubonana godu iveke ezako ngesikhathi esifanako
sama_nbl_10h08oct2022_0004.wav,7.4,N,hlolwa kwendlela yokuphila yeenkhulu zombuso zeminyango eyahlukeneko umkhulumeli we SIU u [kaizer] ganyago uthi
sama_nbl_10h08oct2022_0005.wav,6.8,N,em ehlelweni leli esilithuthukisako lokukhuthaza abentwana bona bazifundele begodu bazijayeze nokufunda
sama_nbl_10h08oct2022_0006.wav,11.4,N,[the decease was identified as] ananiyasi sithole [age thirty seven of] thugwanye [village] umkhandlu wamalungelo wobuntu ehlanganweni yeentjhaba ezibumbeneko uphasise ukuthi kubekwe ibandla elikhethekileko
sama_nbl_10h08oct2022_0008.wav,8.4,N,uphalatse okhutjhwe ngemva kokuthi amalunga womkhandlu alikhulu namatjhumi amathathu nethoba avowudele ukuthi aphume ngombana akasamthembi emsebenzinakhe
sama_nbl_10h08oct2022_0009.wav,8.5,N,alalele usimphi eh kuzwakale ukuthi eh begodu ikghono lakhe lokufunda lifika kuphi begodu yena angasizeka njani
sama_nbl_10h08oct2022_0010.wav,4.7,N,begodu zephasi zizokufunda ngunokuthula ngowaka mtshweni unandala
sama_nbl_10h08oct2022_0011.wav,6.8,N,ngemva kwephenyo amapholisa athole ananiyasi sithole ohlala kiyo indawo leulidwaba uthi baphenya icala lokubulala
sama_nbl_10h08oct2022_0012.wav,17.5,N,elizakuqala izenzo zokwephulwa kwamalungelo wobuntu e [russia] lokhu kuzabe kukokuthoma kwenziwa enarheni elilunga lasafuthi lomkhandluwbezokuvikela wehlangano yeentjhaba ezibumbeneko u [E morgan fogus] we b_b_c uyahlathulula [RUSSIA outstating voting member of the human rights cousel last march]
sama_nbl_10h08oct2022_0013.wav,8.9,N,iphiko eliphenya amacala akhethekileko i [special investigating unit] ithi seyithomile ngomsebenzi wokuqedelela imibiko emalungana noku
sama_nbl_10h08oct2022_0014.wav,8,N,nguye ke ozosilethela iindaba zephasi zanamhlanje eh ngithokoza khulu bangani bami sizokubonana godu iveke ezako
sama_nbl_10h08oct2022_0015.wav,6.9,N,khona bazokwazi kuthi baphimise amagama kuhle khona bazakwazi kuthi eh babize amagama kuhle begodu
sama_nbl_10h08oct2022_0016.wav,5.9,N,zefundo elithi [state your mind] ukhumbuleke babelethi lapho emakhaya kuthi nangabe unomntwana lapho nkhaya
sama_nbl_10h08oct2022_0018.wav,4.8,N,ungomjayeza mani uthi ngabomgcibelo nje khekalalele usimphi ned kanye yabo
sama_nbl_10h08oct2022_0019.wav,7,N,eh ngithi ngikutjhiya no d_j mpumi uzokuraga nehlelo elimnandi elithi jika majika [ten to twelve]
sama_nbl_10h08oct2022_0020.wav,11.2,N,[zalieng marington saabc news parliament] meyara etja [johannesburg] utata murero namhlanje uyokuveza ikomidi yakhe etja azokulawula nayo idorobheli 
sama_nbl_10h08oct2022_0021.wav,7.3,N,lokhu kulandelwa ukutjhwa kuka [doctor] mpho phalatse njengemeyara ye [johannesburg] iveke ephelileko kwaqeda nombuso ohlanganyelweko
sama_nbl_10h08oct2022_0022.wav,5.7,N,asuswe unomphela ama [e tolls] ulisufi umemezele i khabinedakhe etja e [johanesburg]
sama_nbl_10h08oct2022_0023.wav,6.6,N,kutholwe isidumbu sendoda emlanjeni wagwatshwene ngaphandle kwelebowagomo esifundeni selimpopo
sama_nbl_10h08oct2022_0024.wav,5.7,N,umkhulumeli wamapholisa umalisela lidwaba uthi isidumbu sitholwe sinenceba entanyeni
sama_nbl_10h08oct2022_0025.wav,7.7,N,sizibekela la zesimbi yetjhumi bezifundwa ngunokuthula mtshweni kukwekwezi f_m kukhanya ngyabuya ngezesimbi yetjhumi nanye
sama_nbl_10h11jun2021_0002.wav,4.6,N,mahlangu ezilama lezi nge awa lesumi nanye
sama_nbl_10h11jun2021_0003.wav,9.5,N,zivale iindlela godu ngamatje nangamatayera avuthako njengombana zithtoma phasi ijma lazo lokutjhagala endaweni leya
sama_nbl_10h11jun2021_0005.wav,5.1,N,fumanenwe isivumelwano endabeni le itjhebiswano hlangana kweenarha ezimbilezi liqinile
sama_nbl_10h11jun2021_0006.wav,6,N,ekwenziweni kwesibawo sebheyili samadoda abunane abekwe icala lokulala usifiso nene
sama_nbl_10h11jun2021_0007.wav,5.4,N,ukulandela ijima lokutjhagala ebelibanjwe enyangeni edlulileko
sama_nbl_10h11jun2021_0010.wav,8.9,N,ngemva kokubekwa icala lokuthi bebe ifuyo abongazimbi ababilaba nomunye umuntu wesithathu kuzwakala bona babetjhwa
sama_nbl_10h11jun2021_0011.wav,6.3,N,ikwekwezi f_m kukhanya bha iindaba ngeze awa lisumi
sama_nbl_10h11jun2021_0013.wav,5.4,N,umndeni wakwa gupta uzokuphendula kuzwangobasho eqalene nawo esewula afrika
sama_nbl_10h11jun2021_0014.wav,9,N,bavala Indlela i [n three] izakhamuzi zithi umnyango zombuso hlanganyela ubhalelwe eenthembisweni ezenziwe emhlanganwen
sama_nbl_10h11jun2021_0015.wav,5,N,abangaphezu kwe [one million] bafumene umthamo wokuthoma umjovo i [pfizer]
sama_nbl_10h11jun2021_0017.wav,8,N,ikhotho ye [piet retief] empumalanga ilindeleke ukulalela ukunghanghisana kombuso nabogqwetha
sama_nbl_10h11jun2021_0018.wav,8.9,N,ukusetjenziswa kwawo njengombana isenza iphenyo umthamo omjovo oliganiselwa ku [one point two million] kulindeleke bona ukhutjhwe
sama_nbl_10h11jun2021_0019.wav,6.9,N,utjele ikhotho bona abasolwa kufanele banganikelwa ngombana baqalela necala elimbi
sama_nbl_10h11jun2021_0020.wav,5.2,N,umnqophisi womnyango udorhodera sandile buthelezi ngenca yegandeleleko
sama_nbl_10h11jun2021_0021.wav,5.1,N,naphezu kongaboni ngelihlo linye ukuragela phambili njenganje
sama_nbl_10h11jun2021_0022.wav,6.4,N,e sewula afrika ne [united arab emirates] zinetjhebiswano eliqinileko nehle
sama_nbl_10h11jun2021_0023.wav,9.8,N,umemezele namhlanje ekuseni bona [united arab emirates]  ayisebenzisani nesewula afrika ngokuya ngokwesivumelwano eskhona hlangana kweenarha ezimbilezi
sama_nbl_10h11jun2021_0024.wav,8.7,N,kufanele kujovwe ngawo abotitjhere omunye olinganiselwa ku [thirty million] bekulindeleke bona ufike enarheni le eemvekeni ezimbalwa ezizako
sama_nbl_10h11jun2021_0025.wav,4.9,N,izolo ebusuku begade sele bayi [one point six million] abantu abajoviweko
sama_nbl_10h11jun2021_0026.wav,6.6,N,koku [deliver] komjovo bayabhalelwa kuqalana nenembo yawo
sama_nbl_10h11jun2021_0027.wav,4.9,N,nomusa thwalo kuzwakala bona babulawe eplasini e [bamboonkral]
sama_nbl_10h11jun2021_0028.wav,7.1,N,batjhogwa nangegezi barhatjhwa nangamanzi izolo ipholisa eliphenya ngendaba uvukile nhlapho
sama_nbl_10h11jun2021_0029.wav,10.1,N,abatjhagali  babawe umengameli u [cyril] ramaphosa ukungena hlangana indawo ye [harry smith] ikhutjhwe ngaphasi kwakamaspala wemaluthu aphufong 
sama_nbl_10h11may2023_0001.wav,6.8,N,bukuphi ubujamo bangokomthetho bombuso ngendaba yobufakazi obuvele ephikweni leendaba
sama_nbl_10h11may2023_0002.wav,5.7,N,ngaphandle kwekhabo e krospi  anoyise
sama_nbl_10h11may2023_0003.wav,5.9,N,uyokghona njani ukwenza ukuthi umphakathi ukholwa ukuthi ungqongqotjhe aqatjhiweko wegezi
sama_nbl_10h11may2023_0004.wav,5.6,N,nokutjhugululwa kwendlela yokuphakelwa kwegezi ehlungekileko nendabakulu le kathabo [bester]
sama_nbl_10h11may2023_0005.wav,13.7,NS,[joseph] mosia [s_a_b_c news parliament] hlangana nokhunye ke mosia uthi amalunga wepalamende ayokubuza umengameli afaka hlangana umrholi we d_a [johnston heizen]
sama_nbl_10h11may2023_0006.wav,8.5,N,obekwe nge ofisini lakamengameli aksimzamo yokulinga ukutjhugulula umgomo wezegezi na ukusuka epalamende
sama_nbl_10h11may2023_0007.wav,7,N,i aljazera obutjengise abarholi besewula afrika abosomabhizinisi abaziwako namaziko weemali aziwako
sama_nbl_10h11may2023_0008.wav,6.4,N,yezokuvikela nokubeka ilihlo izehlakalo ezenzekako umnyango lo ubhalelwe nokuvuselela ihlelo lokuqalisiswa kwamalayisensi
sama_nbl_10h11may2023_0009.wav,9.3,N,ayokuphendula iimbuzo epalamende ngamadina namhlanje iimbuzo le iyokuhlolwa umengameli kanti isukela kweyokuqatjhwa kwakangqongqotjhe wegezi
sama_nbl_10h11may2023_0010.wav,9.4,N,ngeze awa lesumi iindaba mrhatjho ikwekwez f_m kukhanya bha sithoma ngezithi kuqalwe ukuthi umengameli  wenarha u [cyril] ramaphosa
sama_nbl_10h11may2023_0012.wav,6.3,N,namkha kubotjhwe iinkhulu zomnyango lo ezibhalelwe ukuvuselela ilayisensi yazo yekontraga
sama_nbl_10h11may2023_0014.wav,6.3,N,abakhohlekeleko be eskom be eskom uthi ke umrholo we a_c_d_p u [kenneth] mitshwe yena ufuna ukwazi ukuthi
sama_nbl_10h11may2023_0016.wav,5.4,N,okubange ukulahleka kwamafayili ayikulungwane namakhulu amabili namane [one thousand two hundred and four] 
sama_nbl_10h11may2023_0017.wav,6.2,N,abosokontraga abakhohlakeleko e eskom zibhadelwa iinhlangano zepolotiki boskontraga
sama_nbl_10h11may2023_0018.wav,8.2,N,umengameli uvela kanye qobe kuyi [quater] phambi kwamalunga wepalamende aphendule imibuzo ekhona njengengcenye yokuziphendulela
sama_nbl_10h11may2023_0019.wav,9.6,N,usihlalo we ofisi elilawula ilwazi upantsi tlakula umnyango lo wezobulungiswa uphule indinyana yesumi nathoba yomnyaka ka [twenty twenty two] wokuvikela kwelwazi lomuntu
sama_nbl_10h11may2023_0020.wav,7.6,N,ofiseli liphenya ukwephulwa kwerhelo ngemva kobana umnyango lo ubetheke khulu ngokuba sengozini kwelwazi pheze iminyaka emibili yoke
sama_nbl_10h11may2023_0021.wav,5.6,N,zokulandelela nokuqalisisa kuhle ukukhitjhwa kwelwazi loke ngokungasimthetho emthonjeni yabo
sama_nbl_10h11may2023_0022.wav,7.2,N,bengeze awa lesumi lezo ke ziyalama ze awa lesumi nanye emirhatjhweni ikwekwezi f_m
sama_nbl_10h11may2023_0024.wav,6.4,N,kusesenjalo na sisesekhona isithembiso esinjalo na kuthi u [brad haron] abuze kukuthi
sama_nbl_10h11may2023_0025.wav,5.5,N,oyokubuza umbuzo ophathelene neemali ekuthiwa zibhadelwa
sama_nbl_10h11may2023_0026.wav,5.8,N,ekutheni isuke egezini esebenzisa amalahle iye egezini ebuyelelwako
sama_nbl_10h11may2023_0027.wav,6.7,N,ahlotjanisa nobulelesi na kuthi ke ilunga le a_n_c ukhaya magaxa epalamende abuze uramaphosa ukuthi
sama_nbl_10h11may2023_0028.wav,4.8,N,istatimendeni utlakula uthi umnyango ubhalelwe kubeka ngokwefanelo iinlinganiso zesi [tacnic]
sama_nbl_10h11may2023_0029.wav,7.4,N,siyarharhaba nehlelo emthonjeni bekuyoba semini ekulu nge awa lesumi nambili nogush magesh nomvezi u [quincy] nginguThembisile
sama_nbl_10h11sep2022_0002.wav,10.2,N,kuragela phambili ngokubangela umraro izakhamuzi ziyafuduswa emakhaya ezinye sezibalalekela eendaweni eziphezulu malungana nokuphepha
sama_nbl_10h11sep2022_0004.wav,8.6,N,ipelaveke le kuyokuzwa iinlilo zezakhamuzi kanti ukhamba nomsebenzi kamakhamba ngendlwana ukuyoksiza abantu
sama_nbl_10h11sep2022_0007.wav,6.6,N,kuvuleke idamu lemayini kwabangela iinkhukhula eengcenyeni zedorobha lela 
sama_nbl_10h11sep2022_0010.wav,5.5,N,kuqakathekile ephilweni ukuthi sibabantu singabaqaleli abantu phasi kuqakathekile ukuthi siba
sama_nbl_10h11sep2022_0017.wav,8.3,N,iimphathiswa zomsebenzi wokurhabako neendaba zehlekelele ekurhuleni ziyokuthoma ngephenyo lazo namhlanje
sama_nbl_10h11sep2022_0019.wav,7.9,N,kanti ke begodu kuthunyelwa neemphathiswa ze e_m_s [college] malungana nokuyokusiza
sama_nbl_10h11sep2022_0021.wav,6.7,S,ok'hlangana nabo uzimu ubaletha ngomnqopho ngilokho esikutjhoko iveke le ngithi kuwe
sama_nbl_10h11sep2022_0023.wav,6.6,N,umnyango weendaba zaankhaya nomsebenzi wayo wokhamba ngokunanaba
sama_nbl_10h11sep2022_0024.wav,4.7,S,aksanamuntu ozokuqhubeka namtjhana athuthuke azenza lezo zinto
sama_nbl_10h11sep2022_0026.wav,6.1,N,ikwekwezi f_m kukhanya iindaba ngeze awa lesimu
sama_nbl_10h11sep2022_0027.wav,8.1,S,laithi khumbula ukuthi uvela kude kangangani khumbula ukuthi sewufikephi kodwana
sama_nbl_10h11sep2022_0028.wav,5.5,N,imbiko iveza bona izindlu ezimbalwa endaweni leya kanti idaka namanzi
sama_nbl_10h11sep2022_0032.wav,6.5,N,ngoba uthandi mamakhe usmirhatjhweni ikwekwezi f_m uqakathekile awa lo enghlala naye ngapha nkhaya athi
sama_nbl_10h11sep2022_0033.wav,9.2,N,abantu ababili balatjhelwe ukurhogela isimoko umkhulumeli wephiko lomsebenzi orhabako e [johannesburg] u [eric] maluka
sama_nbl_10h11sep2022_0034.wav,5.7,S,ngoba awazi laba abantu abazakuvulela iminyango ngombanyana abantu boke
sama_nbl_10h11sep2022_0035.wav,6.9,S,baletha epilwenakho ubaletha epilenwakho ngomnqopho kukhona ebazokwenza abanye uzobaletha
sama_nbl_10h11sep2022_0036.wav,6.2,S,nalabo abangasakufowneli lalela mntakababa ungakateleli ukubafownela nalaba abanga
sama_nbl_10h13feb2024_0001.wav,6.5,N,ulayelwe ukuwarhocisa amathenda layo usihlalo wekomidi yeenthuthi yepalamende e=[north west]
sama_nbl_10h13feb2024_0003.wav,10,N,erhelweni leenarha ezingathathi amagadango malungana nobulelesi bokukhukhuthisa imali ekulumiswaneni ekhethekileko nephiko le s_a_b_c
sama_nbl_10h13feb2024_0004.wav,7,N,ibawe ibandla elikhethekileko elphenya amacala kuphenywa ithenda elitjha lokulayitjhwa abafundi ukuya eenkolweni
sama_nbl_10h13feb2024_0005.wav,4.7,N,eenarheni ezibekwe ilihlo ngokungathathi amagadango emacaleni
sama_nbl_10h13feb2024_0007.wav,7.2,N,kungenzeka libangele ukukhuphuka kwentengo eentolo lokhu ngemva kokuthi i SANRAL imemezile bona
sama_nbl_10h13feb2024_0010.wav,5.8,N,ikomidi le ithi isola ngasuthi kube khona umkhwabaniso ekukhutjhweni kwe [tender]
sama_nbl_10h13feb2024_0012.wav,5.9,N,ethoma namhlanjesi iphela ksasa umengameli u [cyril] ramaphosa uyokuphendula
sama_nbl_10h13feb2024_0013.wav,7.6,N,iyokhuphuka nge  [six point five percent] imali yeendlela ezibhadelwako ukthoma mhla lilinye ilanga ngenyanga ezako
sama_nbl_10h13feb2024_0014.wav,8.1,N,amalunga wepalamende newomkhandlu weemfunda alindeleke ukuzibandakanya kukulumopikiswano
sama_nbl_10h13feb2024_0016.wav,4.9,N,kwebubulo elitshwenyako isewula afrika inethemba lokukhutjhwa
sama_nbl_10h13feb2024_0017.wav,10.6,N,[in those cases] kanti ilindeleke ukuthoma ukuthoma ekseni nje ikulumopikiswano epalamende malungana nekulumo kamengameli yobujamo benarha
sama_nbl_10h13feb2024_0018.wav,7,N,ukutlhayela kwebabambiswano hlangana kwezinye iinkampani kulethe ukuzaza ngamahlelo eesewula afrika wok'khutjhwa
sama_nbl_10h13feb2024_0019.wav,5.9,N,I  [financial inteligence centre] ithi abogqwetha bomthetho nebemakhiwo babalwa hlangana
sama_nbl_10h14apr2024_0005.wav,7.5,N,ikomitjhini le itjhinge ekhotho yomthethosisekelo yokufaka isibawo sokuphikisa isiqunto esikhutjhwe yikhotho yezekhotho esinyule ihlangano le
sama_nbl_10h14apr2024_0008.wav,5.8,N,indaba ekhamba phambili ngethi inarha ye [iran] iyelelise ye [israel] ngokuthi ingathoma ilinge ukuzibuyiselela 
sama_nbl_10h14apr2024_0011.wav,8.3,N,kanti lokho ukutjho eralini ebekayibambe e [cape flats] uthi iyokuragela phambili ipi yokulwela abantu abathathelwa phasi enarheni le
sama_nbl_10h14apr2024_0012.wav,6.3,N,inarha ye [iran] iyelelisa ye [israel] ngokuthi ingathomi ilinge ukuzibuyiselela
sama_nbl_10h14apr2024_0013.wav,11.1,N,kanti ihlangano le yatjhinge ekhotho yezekhetho ngemva kokuthi ikomitjhini yekhetho ikhandele uzuma ukuthi abe serhelweni labonkhethani abaphalisanela ikhetho eliyobanjwa ngenyanga ezako
sama_nbl_10h14apr2024_0014.wav,7.1,N,ngyalotjhisa eendabeni ze awa letjhumi ikwekwezi f_m ezifundwa nguthembisile wakwamnisi
sama_nbl_10h14apr2024_0015.wav,9.9,N,kanti phambilini i [iran] ilinge ukunikela ngeenzathu zokuthi kubayini isahlele i [israel] ngokuthi iyisahlelele izinto ezimbi ezenziwa yi [israel]
sama_nbl_10h14apr2024_0017.wav,8.7,N,ngemva kokuhlaselwa kwayonge[drone] nangeembhomu eziphoswako begodu yayelelisa ne [america] ngokuthi ingasekeli amajoni we [israel]
sama_nbl_10h14apr2024_0018.wav,9.7,N,phambilini umengameli we [america joe biden] uthe amajoni wenarhakhe asebenzisa iimphaphamtjhini neensetjenziswa ezivikele ukusahlelwa ukusiza i [israel]
sama_nbl_10h14apr2024_0019.wav,6.8,N,kanti hlangana nazo ibala ukuthuthumbisa kwayo ikampayo ekhabe ihlala iimphathimandla zayo e [siria] ngenyanga ephelileko
sama_nbl_10h14apr2024_0020.wav,6.4,N,kunokucabhela ngokwepolotiki endabenayo nomrholi womkhonto wesizwe [party] u [jacob] zuma
sama_nbl_10h14apr2024_0021.wav,9,N,bekuziindaba ze awa letjhumi kukwekwezi f_m ezifundwa nguthembisile wakwamnisi ngyabuya nezilandela lezi ze awa letjhumi nanye
sama_nbl_10h15may2024_0004.wav,4.9,N,nokukhuphuka komkhiqizo weenkolo ebubulweni lemikhiqizo
sama_nbl_10h15may2024_0007.wav,5.9,N,uhlangana nalaba abamasumi abunane nanye egade basebenza nakuwa umakhiwo
sama_nbl_10h15may2024_0008.wav,16.8,N,nginguLindiwe mahlangu ezilama lezi ngeze awa lesumi nanye
sama_nbl_10h15may2024_0009.wav,7.6,N,kuwe amastezi ambalwa isidumbu sakamagcwalisa kwanje siiyokuthunyelwa epumalanga kapa
sama_nbl_10h15may2024_0010.wav,8.6,N,ukube nesenzo sesintu esenziwako ehlangothini lalapho kwawa khona umakhiwo e [george] etjingalanga kapa
sama_nbl_10h15may2024_0011.wav,7.9,N,uthi esabelweni seemali kunengcenye i n_h_i eyokuhlonywa khonokho [the aspects of it that not require]
sama_nbl_10h15may2024_0015.wav,8.5,N,zangaphandle zithi ubuphathi baka [joe biden] buvumile bona buyoragela phambili ngokuthunyelwa kweenkhali [israel]
sama_nbl_10h15may2024_0016.wav,8.4,N,kanti ke ungqongqotjhe weendaba zeemali u [enock] godongwana uthi i [national health insurance]
sama_nbl_10h16nov2023_0002.wav,9.9,N,unaledi ubalwe njengomunye wabatloli bengoma ka [chris brown] ethi [shooter] umfundi lo uka [grade eleven] ofunda esikolweni samabanga aphezulu ikhethokuhle [secondary]
sama_nbl_10h16nov2023_0003.wav,4.7,N,ividiyo leyo nendlela ebekavuma kamnandi ngakhona yakara u [chris brown]
sama_nbl_10h16nov2023_0004.wav,9.4,N,ekhotho ephakemeko epitori izolo kuvele bona kunezinto ezikhambisana neminye imininingwane evezwe ngumukghane ekhotho
sama_nbl_10h16nov2023_0005.wav,7.4,N,ikomitjhini yezamaphaliswano ihlathulule umthelela ongabangelwa kugiribezwa kweranda ziimbhanka
sama_nbl_10h16nov2023_0007.wav,11,N,sithoma ngezithi amagqwetha wabasolwa ecaleni lobulawa kwakasenzo meyiwa ayokuragela phambili namhlanjesi ngokutjhukwa ngemibuzo ufakazi wombuso u [seargent] vusumuzi mokghane
sama_nbl_10h16nov2023_0008.wav,8.2,N,igqwetha lomsolwa uthulani mngomezulu ubawe bona umbuso umnikele imininingwane ye [tracker] yeenkoloyi ezasetjenziswa ngumokghane ngesikhathi
sama_nbl_10h16nov2023_0009.wav,4.9,N,lotjhani eendabeni zesimbi yetjhumi kuwekwezi f_m kukhanya bha ngunokthula
sama_nbl_10h16nov2023_0010.wav,6,N,ikhomitjhini esebenzisana neembhanka ezihlanu kezimatjhumi amabili nobunane ephenyweni
sama_nbl_10h16nov2023_0012.wav,9.4,N,yagcina irhatjheke eenkhundleni zokuthintana ngomnyaka ophelileko uthi ukusebenze no [brown] sekumvelele amathuba amanengi ama [artist] aseyangazi
sama_nbl_10h16nov2023_0013.wav,6.8,N,ngemva kwamajima wokusetjha e [alshifa] kunembiko yokobana iingaragara zisuse koke ebeku lapho
sama_nbl_10h16nov2023_0014.wav,6.6,N,ebangelwe kubhubha komrholi wegenge i [haiti] iqalene nomraro wamagenge athethe ilawulo le [poara hucranse]
sama_nbl_10h16nov2023_0015.wav,9.8,N,amapholisa wetlhagwini kapa athi abophe abantu abamayina ngokungemthetho amazamazama angaphezu kwamakhulu abunane e [klense namaqua land] 
sama_nbl_10h16nov2023_0017.wav,7.6,N,ngeenyanga embili ezidlulileko abasolwa ababotjhwe ejimeni lamapholisa lokulwa nobulelesi bokulwa bokumayina ngokungemthetho esifundenesa
sama_nbl_10h16nov2023_0018.wav,8.9,N,akhambakhamba nontanzi umengameli waphambilini ukghalema motlanthe uthi amalunga ajame iinhlangano zepolitiki epalamende
sama_nbl_10h16nov2023_0019.wav,5.7,N,ukungabi neencwadi zobakhamuzi nokutholakala endaweni ebebanganamvumo yokungena kizo
sama_nbl_10h16nov2023_0020.wav,5.2,N,wagadangiswa ividiyo ngutitjherakhe ngeklasini avumela abanye abafundi
sama_nbl_10h16nov2023_0021.wav,5,N,amajoni we [israel] awakabi ukuveza ubufakazi bamathaneli ekuthiwa akhona
sama_nbl_10h16nov2023_0022.wav,36,N,umotlanthe ongusihlalo webhodi wezikweli uthi unamalunga wepolitiki azithola agcina akhetha phakathi nokuhlonipha umthethosisekelo wehlangano newenarha [mp for instance is in party member he or she or it  will abide aims and objectives of the parties set out in the parties constitutions ladies and gentleman certain gaps are exposed and possible frictions for party members of parliament arise because some part of constitutions ]
sama_nbl_10h16nov2023_0023.wav,8.7,N,umntazana wenandae [durban] wemnyaka elitjhumi nekhomba uzithandela ukuvuma begodu uvuma njengenyoni
sama_nbl_10h16nov2023_0024.wav,7.8,N,iimbhanga ezihlanwezo zizokunikela nekomitjhini ubufakazi obuzokusiza ecaleni elithinta iimakethe zeemali zangaphandle
