filename,duration,flag,transcription
sama_nbl_17h25apr2023_0025.wav,7,N,hlangana nezinye sithola ezithi akasekho umvumi we [america] owaziwako u [harry belafonte]
sama_nbl_17h25apr2023_0027.wav,7.8,N,evakatjhweni ekngasilo leburhulumendeni I atm ithi ifuna umvikeli womphakathi aphenye ngokuthi
sama_nbl_17h25apr2023_0028.wav,9,N,bobane abasolwa ecaleni lobulawa kwalowo obeka ngunobhala mazombe wephiko lelutjha le a_n_c usindiswa magaxa 
sama_nbl_17h25apr2023_0029.wav,8.4,N,sirhugwe yindaba yokuthi yona lekhotho ekhulnyiswako ikhiphe incwadi yokuthi isewula afrika ayibophe umengameli we [russia]
sama_nbl_17h25apr2023_0030.wav,7.8,N,umvumi we [america harry belafonto] nebekaziwa ngokulwisana nebandlululo enarheni leya akasekho
sama_nbl_17h25apr2023_0033.wav,8.9,N,isiqhema esibusako se a_n_c  sathatha isiqunto sokuphuma ngaphasi kwekhotho le ekhonferensini yayo yomnyaka ka [twenty seventeen]
sama_nbl_17h25apr2023_0034.wav,5.7,N,asinda ke nokho amakhansela amabili agade akhambisana nawo mlungisi xalane
sama_nbl_17h25apr2023_0035.wav,9.7,N,u [vlader  meer putin] ozabe akhambele ikhonferensi ye briks ezabe ibanjelwe khona ekhethwapha ngo [august] womnyaka lo
sama_nbl_17h25apr2023_0036.wav,8.9,N,i [african transformation movement] ikhambise isinghonghoyilo kumvikeli womphakathi
sama_nbl_17h25apr2023_0037.wav,7,N,[marries boy chart ] naleyo eyaphuma phambili ngitjho ne [united kingdom] I [one day oh]
sama_nbl_18h02aug2022_0007.wav,10.3,N,ukuzwa ngokunabileko ngalokhu asibikele mbikiindabethu ngunompumelelo mahlangu matlhuwo wodwa emndenini wakwamasinga lapha ulinda shabalala abhubhele khona
sama_nbl_18h02aug2022_0008.wav,21.5,N,du asibuyele kusbu ulalele ihlelo zibuya nabazumi sithandathu kwaphela imizuzu ngemva kwe awa lesithandathu ihlelo zibuya nabazumi livezwa ngunompumelelo mahlangu kuthi lapha etafuleni lamatjhada nemidumo kunokageso metlhuko
sama_nbl_18h02aug2022_0012.wav,9.4,N,[they must arrest this giuy] kuthiwa shabalala bekasese neenyanga eentathu kwaphela ahlala ethembisa ahlale ekamurweni elingemva
sama_nbl_18h02aug2022_0013.wav,7.2,N,abafundi abafunda ugreyidi [twelve] ababili baquntwe bebabulawa endawaneni ebebaqatjhe kiyo
sama_nbl_18h02aug2022_0014.wav,9.9,N,bathi ulinda shabalala udunyuzwe wabulawa lipholisa kuthiwa udunyuzwe asekhaya akusikude nalapha kuhlala khona ipahla kamasipala
sama_nbl_18h02aug2022_0016.wav,5.3,N,umsolwa lo bekavele kafitjhazana ekhotho mayelana namacala amabili wokubulala
sama_nbl_18h02aug2022_0017.wav,6,N,ukubhalelwa kukarhulumende ngokuqinisekisa ukulandelwa komthetho mayelana nokuvalwa kweemayini
sama_nbl_18h02aug2022_0018.wav,5.7,N,uthi nabambuza ukuthi kubayini ngombana abekho estradeni begodu kunedrada
sama_nbl_18h02aug2022_0019.wav,5.4,N,nendawo ebebaqatjhe kiyo nakuyokubonwa isidumbesi 
sama_nbl_18h02aug2022_0020.wav,7.3,N,la silahlwe khona kusolakala ukuthi umsolwa ubaleke ngokweqela ngemlanjeni wat
sama_nbl_18h02aug2022_0022.wav,7.3,N,ngombana babonile ukuthi kwenzekeni wathi ipholisa lingene ngejarideni lamdumuzela khona
sama_nbl_18h02aug2022_0023.wav,7.2,N,esinye sesidumbu sabongazimbaba sitholwe ngokukhamba kwesikhathi ebangeni elikudanyana
sama_nbl_18h02aug2022_0024.wav,9.4,N,nangu umukantsi uyahlathulula ukuthi kwenzekeni uthi bebazijamele ngejarideni kwafika ipholisa labalayela ukuthi bangena ngendlini
sama_nbl_18h02aug2022_0025.wav,10.5,N,la kubikwe khona ukuthi kutjhiswe imakhiwo neenkoloyi zakamaspala batjho bekajame ngaphandle agadangisa ividiyo ngokwenzakalako ngesikhathi azakdunyuzwa
sama_nbl_18h02aug2022_0029.wav,7.7,N,ngaphandlanyana kwe [crage town] esewula yesifunda sakwazulu natal abongazimbaba bebaqatjhe endaweni le
sama_nbl_18h02aug2022_0030.wav,6.5,N,udadwabo ubhevali masinga uthi ukubhubha kwakhe kubaphazamisile emkhumbulweni
sama_nbl_18h02aug2022_0033.wav,12.5,N,eisthoma ngazo namhlanje ngilezi ezithi omunye womndeni wabantu abane ababhubhe ngesikhathi somtjhagalo ethembisa izolo lapha esifundeni se [gauteng] uthi usathukiwe ngesehlakalwesi
sama_nbl_18h02aug2022_0035.wav,9.5,N,umnikazi womuzi usheli mukansi uthi abakalahlekelwa ngumnakwabo kwaphela kodwana balobu umuntu obekaqinisekisa ukuthi
sama_nbl_18h02aug2022_0036.wav,9.6,N,[much chaos] indaba ilandelako le inokulumela phakathi siyelelisa abalaleli nabentwana abaneenhliziyo ezibuthakathaka
sama_nbl_18h02aug2022_0037.wav,6.3,N,koke kukhamba kuhle emzini loyo ngombana bahlala babantu bengubo babodwa
sama_nbl_18h02aug2022_0041.wav,5.6,N,thaya ngaphezulu wayokuphundlukela ngale komlambo umnyango woku
sama_nbl_18h02aug2022_0045.wav,5.1,N,indawo awele kiyo isabonakala kuvalwe igazi ngebhoksi
sama_nbl_18h02aug2022_0046.wav,5,N,ukuze bakghone ukuya esikolweni samabanga aphakemeko esendaweni le
sama_nbl_18h03jul2023_0002.wav,4.8,N,izolo kubonakele yehla inturhu kwaba nabantu abambalwa ababotjhwako
sama_nbl_18h03jul2023_0003.wav,7,N,naphezu kwalokhu batjho iranda likhambisana nobungozi akwaziwa ukuthi miphumela enjani ezokvela ngalokhu
sama_nbl_18h03jul2023_0010.wav,12,N,ukuthuthukisa umthangalasisekelo wamanzi nekhucukhucu urhulumende uthi ijima leli lathoma ngomnyaka odlulileko ngehloso yokuqedwa ngomnyaka ka [twenty thirty]
sama_nbl_18h03jul2023_0012.wav,9.6,N,sithokozile kulindiwe mahlangu ngeendaba ze awa lesithandathu njenganje e [studio] samahlelo weendaba ezinabileko sisikimisa ihlelo zibuya nabazumi le ikwekwezi f_m kukhanya bha
sama_nbl_18h03jul2023_0013.wav,5.5,N,abanye abantu bahlaba abarholi ngokuphila ipilo ephambili ngokungayi ebantwini
sama_nbl_18h03jul2023_0015.wav,5.9,N,dizela iyokhuphuka hlangana kwe [eighteen cent] ne [twelve cent] ilitha
sama_nbl_18h03jul2023_0017.wav,7,N,isize ngokuthi ihlangano ye a_n_c ibuyele esigeni sayo sokuba yihlangano yabantu
sama_nbl_18h03jul2023_0020.wav,5.3,N,kungomvulo namhlanje amalanga mathathu inyanga ngovelabahlinze unyaka ngweenkulungwane eembili
sama_nbl_18h03jul2023_0024.wav,6.7,N,okhunye ekulindeleke ukuthi kuthunaze ukwehla kwentengo yeembaselokhu yintengotjhuguluko enarheni le isakhwinyalele
sama_nbl_18h03jul2023_0029.wav,4.9,N,ungqongqotjhe uthe ngalokhu bahlose ukuhlanganyela namabubulo azijameleko
sama_nbl_18h03jul2023_0030.wav,13.6,N,ngaphasi kwehlelo likarhulumende lamanzi kulindeleke bona kube nokukhokhwa komoya njengombana intengo yepetroli iyokwehla ngelesithathu kodwana intengo yedizeli iyokukhuphuka njengombana
sama_nbl_18h03jul2023_0034.wav,6.4,N,abonakala athulile amajima aguruzelako e [france] ukulandela amalanga ma
sama_nbl_18h03jul2023_0035.wav,11.7,N,[most lately applicable on both petrol and diesel] okwanje umnyango lo uthe ayikho ikhambela phambili yekambiso yokuphungula kweentengo yeembaseli ezokulandelwa mayelana nenyanga le yoke
sama_nbl_18h03jul2023_0040.wav,5.6,N,ngingulindiwe  mahlangu ezilama lezi ngeze awa lekhomba
sama_nbl_18h03jul2023_0041.wav,10.4,N,uveze ukuthi ifunisela yokuhluma komnotho evezwa eemarageni zeentjhabatjhaba sona sizathu esibangela imilandelande yokwehla kwentengo yeembaseli amalanga la ukhumalo uthe
sama_nbl_18h03jul2023_0043.wav,6.5,N,kube siyazi ukuthi kuhlekuhle umbango yini utebogo banovelile basihlathululele ukuthi umbango yini
sama_nbl_18h03jul2023_0044.wav,6.3,N,kanti ke ipharafini iyokwehla nge [four cent] ilitha irhasi yehle nge [two rand ninety six cent] 
sama_nbl_18h03jul2023_0045.wav,7.5,N,bambisene no [kate] mahlangu laphana etafuleni lamatjhada nemidumo lami ibizo ngingusbusiso skosana esithoma ngazo namhlanje ngilezi ezithi
sama_nbl_18h03may2021_0001.wav,5.8,N,khona unamnisi ngyathokoza sbusiso ikwekwez f_m kukhanya bha
sama_nbl_18h03may2021_0002.wav,6.6,N,sithoma ngazo zona lezi ezithi umaspala we [steve] tshwete uhlome ijima lokukhulumisana neemphakathi eyakhele umaspala lo
sama_nbl_18h03may2021_0004.wav,6.4,N,ya ksasa ukhona umdlalo eh nanganamala ngbone ngathi uthabi mabhena nguye zabe awuphethe umdlalo
sama_nbl_18h03may2021_0005.wav,9.3,N,iba sithandathu kwaphela imizuzu ngemva kwe awa lesithandathu ihlelo zibuya nabazumi livezwa nguzolothi masango obambisene nonompumela mahlangu kuthi etafuleni lamatjhada nemidumo
sama_nbl_18h03may2021_0006.wav,6.1,N,uthe nakakhuluma ngeentjhitjilo zokuba semthethweni komtloli wamafa owatjhiywa lilanga elacimako
sama_nbl_18h03may2021_0009.wav,10.6,N,arha ke siyathokoza mhlonitjhwa umasipala we [steve] tshwete ufunyenwe umbiko omuhle wokusetjenziswa kweemali wangonyaka ka [twenty twenty twenty twenty one]
sama_nbl_18h03may2021_0010.wav,7,N,siyathokoza hlangana nesiziphetheko entambama namhlanje ngezejima lakamaspala we [steve] tshwete lapha esifundeni sepumalanga ukulalela amazizo womphakathi
sama_nbl_18h03may2021_0011.wav,5.8,N,ijimeli lidoswa phambili li ofisi likameyara ngalokho okwaziwa ngokuthi yibhajethi indaba
sama_nbl_18h03may2021_0014.wav,8.5,N,ngeendaba ethinta isabelo seemali ngale kwalokho sokutjheja ke zabasebenzi bakamaspala we [doctor] js moroka khona lapha esifundeni sempumalanga
sama_nbl_18h03may2021_0015.wav,7.7,N,aragele phambili nokulandela iimthetho yokukhandela urhatjheka kwe [covid nineteen] bazivikele ngokuqalangana bangahlangani ngobunengi
sama_nbl_18h03may2021_0016.wav,7.8,N,ayingene ku [top eight] akhe utjele minake ngikuzwa uthi niyazi ukuthi ikinga ye [chiefs] ivela kuphi khusibeke emkhanyweni mina angazi ivelaphi kanti 
sama_nbl_18h03may2021_0018.wav,11.3,N,abantu nabangalandeli imithetho ebekiweko ihlangano elwela amalungelo wobuntu I [amnesty international] ibawe umbuso nabosopolotiki bona
sama_nbl_18h03may2021_0019.wav,6.3,N,bavunyelwe ukwenza umsebenzabo ngaphandle kokutlhoriswa kuthuselwa nokuthathelwa amagadango
sama_nbl_18h03may2021_0022.wav,11.6,N,bakzwakalise tjhatjhalazi ukuthembeka kwabo iimbikiindaba namhlanje kugidingwa ilanga letjhaphuluko yeembikiindaba ihlangano le ibuyelele godu yabawa ukuthi ababikiindaba abazijameleko
sama_nbl_18h03may2021_0024.wav,6.1,N,zokukhandela ukuphunyeleliswa komtlolo wokugcina welanga uzwelithini ohlathulula ukwatjiwa kwamafakhe
sama_nbl_18h03may2021_0025.wav,4.6,N,nikghono njani ukukfikelela lokhu
sama_nbl_18h03may2021_0028.wav,5.8,N,baragele phambili nokumbatha ama  [mask] baqalangane bahlanzekise izandla zabo
sama_nbl_18h03may2021_0030.wav,8.9,N,arha ke njenganje kumayelana nebhajethi indaba ungakhe uhlathulule ungenelele ukuthi ibhajethi indaba le imayelana nani
sama_nbl_18h03may2021_0031.wav,6.7,N,ukusayinwa kwabadlali [big joe] wo nayingasayina abadlali kuzoklunga 
sama_nbl_18h03may2021_0032.wav,6.3,N,kungene ezdlala kuhle unyakozako ayiyokudlala njalo ayiyo dlala njalo izo [improver]
sama_nbl_18h03may2021_0033.wav,7,N,ebawubambe ngethungelelwano le inthanethe esemzimkhulu we [jenever switzerland] wazwakalisa lokhu 
sama_nbl_18h03may2021_0034.wav,6.8,N,bahlale bambethe amamaksi avalipumulo nomlomo bavule amafesidiri bahlanzekise nezandla zabo
sama_nbl_18h03may2021_0035.wav,13.4,N,baqothelwe nemahlelweni wezokuthintana umphathi wephiko lezokuthintana u [janevev quital] uzwakalise lokhu [while the media in south african enjoys more freedom than many more counter parts in the contitent]
sama_nbl_18h03may2021_0036.wav,12.4,N,umantfombi  dlamini zulu afihlwe ngesilahlo sekambiso yesifunda uzikalala bevakatjhele endlini yebukhosini bamazulu kwakhangela mankengane kwanongomba la bekayobhodlela khona emswaneni
sama_nbl_18h03may2021_0037.wav,6.7,N,iingwenyama u [goodwill] zwelithini waba umndeni ukuthi ulinge ukurarulula umrarwawo ngaphakathi
sama_nbl_18h03may2021_0038.wav,7.3,N,kuno [sedrik] themba lami ibizo ngingusbusiso skosana ngyalotjhisa kuphi nakuphi la kufika khona umrhatjho ikwekwezi f_m kukhanya bha
sama_nbl_18h03may2021_0039.wav,9.7,N,ukuyinabisa indaba le sikhulumisana nomeyara kumaspala we [steve] tshwete ukhansela dephala motsepe khansela motsepe litjhingile begodu siyalotjhisa begodu siyanamukela emrhatjhweni ikwekwezi f_m
sama_nbl_18h05sep2022_0006.wav,5.6,N,wenza nje vele nebhigirini yephasi akuthunani bona ibhode ibholo
sama_nbl_18h05sep2022_0007.wav,10.4,N,katelele iinqhema zoke bona zibe neenqhe khuluma ngeenqhema ezikulu ezidlala ku psl bona zibe neenqhema zabomma nofana ke
sama_nbl_18h05sep2022_0008.wav,7.1,N,wagcina akhonjiwe nokho ikarada elisarilani linye uhlezi ngaphandle ke namhlanje indawakhe ithethwe
sama_nbl_18h05sep2022_0014.wav,6.3,N,tle eh kanengi ke aye baqale bona ke isqhema se [brazil] izinga liphezulu khulu
sama_nbl_18h05sep2022_0015.wav,6.4,N,bekfanele mhlambe ayigobe msinya wasolo ayiraga njengomuntu eh ofuna ukuthintwa
sama_nbl_18h05sep2022_0023.wav,6.4,N,eh udlamini namhlanje uthonyiswa lapha ebhangeni udlamini uyazi ukuthi nanyana kuthunjwa
sama_nbl_18h05sep2022_0024.wav,6.8,N,u [three] nodi loya bekumagondelo womathathu akhandelekako besingadlala ngonodi nodi
sama_nbl_18h05sep2022_0028.wav,4.9,N,abodade nofana abefazi eh nasi I [brazil] iyimbi ngesingceleni
sama_nbl_18h05sep2022_0035.wav,5.6,N,begade kudlalwa umdlalo kubonakele ke isewula afrika iloba ngamagondelo amathathu elizeni 
sama_nbl_18h05sep2022_0038.wav,5.6,N,bona ukuba semazingeni aphezulu emaligini aphezulu phetjheya
sama_nbl_18h05sep2022_0050.wav,8.1,N,namhlanje babuya nge [four four one one] ngiyathokoza bathabile siwubonile umdlalo ogade use [orlando]
sama_nbl_18h05sep2022_0051.wav,6.6,N,babahlule ngo [three] nodi ibanyana banyana gade kungibo abaphethe ibholo kuhle esiquntwini sokthoma
sama_nbl_18h05sep2022_0052.wav,7.7,N,ngu [jane] nofana ngujane ngujane ngujane refiloe jane urefiloe kuhlekuhle ungumsizi ka [captan] mlaleli
sama_nbl_18h05sep2022_0053.wav,5.1,N,gade akhandeleka woke bathabile ubona bona abadlali bethu ngemva eh
sama_nbl_18h05sep2022_0054.wav,5,N,ehlezi naleya mlaleli wekwekwezi f_m iyaphunyurha ibanyana banyana
sama_nbl_18h06jul2023_0002.wav,6,N,siyathokoza kuthokozani bekasivalela ihlelo kwanamhlanje uthokozani
sama_nbl_18h06jul2023_0005.wav,9.6,N,ukubotjhwa kwakhe etanzina ngo apreli umagudumana uveze bona ukubotjhwa kwakhe kwenziwe ngokungemthetho begodu kwenziwe
sama_nbl_18h06jul2023_0007.wav,5.4,N,ungcwatjwe ngokuya ngesikopilo lanama [muslim] emathunjini we [west park]
sama_nbl_18h06jul2023_0008.wav,6,N,icosatu kwazulu natal ikhombele urhulumende ne [transnet ] ukulisa lokho ekuhlathulula
sama_nbl_18h06jul2023_0009.wav,8.4,N,e drc umashatile uhlathulule u [pahart] njengomzabalazeli wekululeko othembekileko
sama_nbl_18h06jul2023_0010.wav,5.9,N,no sithokozile kwanamhlanje mlaleli isiqhema se [three two six] sakhlangana nawe godu ksasa
sama_nbl_18h06jul2023_0011.wav,8,N,sikutjhiya nesibusiso kanti kubayini ungathi niyakhamba ngikubiza nje wo uyangibiza usesekhona ngikhona ngikhona sbu wavela ulwa njeke
sama_nbl_18h06jul2023_0013.wav,5.4,N,lisekela lakamengameli u [paul] mashatile njengebambela lakamengameli
sama_nbl_18h06jul2023_0014.wav,7.4,N,nekathula ikulumo yokumhlonipha njengomengameli u [cyril] ramaphosa asevakatjhwni lombuso
sama_nbl_18h06jul2023_0015.wav,6.5,N,amatjhumi abunane nane ubudala kanti unikelwe umngcwabo wombuso wesigaba sesibili omenyezelwe
sama_nbl_18h06jul2023_0017.wav,7.8,N,kanti umakekere we a_n_c ongasekho nongungqongqotjhe walokha nge ofisini lakamengameli u [eso pahart]
sama_nbl_18h06jul2023_0019.wav,10.1,N,isiqunto sekhotho ekulu efreystata sokurarha isibawo saka [doctor] nandipha magudumana sokuthi kumenyezelwe njengokuphambene nomthetho ukubotjhwa kwakhe
sama_nbl_18h06jul2023_0022.wav,5.5,N,abanikelwe imali nabo efana nalaba bebafana bafana neemponza lezi
sama_nbl_18h06jul2023_0023.wav,5.9,N,zebafana bafana kumele zibizwe nazo eh zikwazi ukuthi zikwazi ukuhti zisponzare leenqhema
sama_nbl_18h06jul2023_0024.wav,10.9,N,wo ngikho nje sibathebathe iwumo leendaba kunghwayi awa bathi ifene leya edira ibuyile angazi mhlambe  singakuboleka iskhathi [after] iindaba nje nawe uthi angibethe umlozi
sama_nbl_18h06jul2023_0025.wav,5,N,njengokubeka elawulweni langeqadi iinteji zeemkumbi kwazulu natali 
sama_nbl_18h06nov2023_0001.wav,7.2,N,bademba nendaba emayelana nekghonakalo yokuthola iinsombululo nanyana kunjalo kusese nethemba lokuthi
sama_nbl_18h06nov2023_0002.wav,7.7,N,ukuthulela iindaba sesimbi yesithandathu lotjhani sitjhaba sekhethu indaba ekhamba phambili ngaleli awa kusese yindaba ethi
sama_nbl_18h06nov2023_0003.wav,7.2,N,isteytjhi esiphehla igezi i [arnot power station ] ese [middelburg] esifundeni sepumalanga amandlawo aphehla igezi
sama_nbl_18h06nov2023_0005.wav,4.8,N,umnyango awukabi ukuphefumula ngendaba le amanye wamalunga womphakathi
sama_nbl_18h06nov2023_0008.wav,4.9,N,nonombuso mahlangu kuthi lapha etafuleni lamatjhada nemidumo kuntando
sama_nbl_18h06nov2023_0009.wav,19.8,N,ulalele ihlelo zibuya nabazuma nosibusiso skosana sithokozile ku [january] masango ngeendaba ze awa lesithandathu nje e [studio] samahlelo iindaba ezinabileko  sisikimisa ihlelo zibuya nabazumi le yikwekwezi f_m kukhanya bha
sama_nbl_18h06nov2023_0010.wav,10.1,N,nakho lapho ungakwazi ukuthi utlole wakho umbono kuyokuthi ngokukhamba kwesikhathi sizakwazi ukuthi siwudlulise emoyeni umbono wakho nje sithoma ngokuthengisa
sama_nbl_18h06nov2023_0011.wav,17.1,N,luthuli lami ibizo ngusibusiso skosana ngyaklotjhisa kuphi nakuphi lapho kufika khona umrhatjho ikwekwez f_m ukukhanya bha njengemhleni sikunikela ithuba ukuthi sizwe wakho umbono kodwana ke namhlanje i[computer] le esiyisebenzako bona sithole ama [email] nalapha ku [facebook] ayisebenzi
sama_nbl_18h06nov2023_0012.wav,5.5,N,[nine six five six seven five fou] I [email] ne [facebook] ungathomi uzisebenzise namhlanje
sama_nbl_18h06nov2023_0013.wav,9.7,N,nokusiza imiphakathi ebusuku ngonobangela wokungabi negezi i [transformer] eyonakala ngenyanga kasinyikhaba  umnyaka ophelileko lo ayikabi ukulungiswa nanje 
sama_nbl_18h06nov2023_0014.wav,5.2,N,nteliswa kwegezi enarheni le njengoba ukusebenza kwayo kutjengisa ituthuko nje
sama_nbl_18h06nov2023_0017.wav,6.7,N,utjhiye abahlali bemutshatshi [kloof] neendawo ezakhelene neendawo le esifundeni selimpopo banganamanzi
sama_nbl_18h06nov2023_0019.wav,6.5,N,abasolwa ababili ababotjhwe mayelana necala elihobene nokweba eplasini lakamengameli [cyril] ramaphosa iphalaphala
sama_nbl_18h06nov2023_0022.wav,4.8,N,i eskom nabasebenzi la bebademba iindaba ezimayelana neentjhijilo
sama_nbl_18h06nov2023_0024.wav,6,N,abalimi abangaphasi kwehlangano idzanini [irrigation board] basolwa ngokukhandela
sama_nbl_18h06nov2023_0028.wav,4.7,N,nasele kuyokuphela umnyaka lo i eskom izobe seyiphungulile ukqu
sama_nbl_18h06nov2023_0030.wav,8.5,N,estatimendeni ihlangano le iveze ubudisi bomtlhago weensetjenziswa zamanzi oqalene nabosomaplasi
sama_nbl_18h06nov2023_0031.wav,11.2,N,kungomvulo namhlanje amalanga asithandathu yinyanga ngunovemba unyaka ziinkulungwane ezimbili uleke ngeminyaka ematjhumi amabili nemthathu phezulu [six november twenty twenty three]  ihlelo livezwa nguzolothi masamgo ubambisene
sama_nbl_18h06nov2023_0032.wav,9.7,N,ngonobangela wesikhathi angisale ngizibamba la zangaleli awa iindaba seengzakbuya nezinye zesimbi yekhomba okwanje asithule sithi du sibuyele kusbu nesiqhema sakhe
sama_nbl_18h06nov2023_0034.wav,5.1,N,siyathokoza kusiya e [vaal]  ngithathe wokuphela ngapha usemoyeni yetjhe
sama_nbl_18h06nov2023_0037.wav,6.8,N,sokubawa ukuthi usithumele iphimbo eligadangisweko ku [zero seven nine nine six five six seven five four zero seven nine]
sama_nbl_18h06nov2023_0038.wav,8.7,N,baphoswe ngecala lokugcekeza nelokweba omunye wabasolwa ubotjhwe e [rustenburg] izolo omunye wabotjhwa ebelabela namhlanje
sama_nbl_18h06nov2023_0039.wav,5.6,N,iimbotjhwa ezilinde ukuthi kuyokulalelwa amacalazo zisiwe kamanye ama [police] steytjhi
sama_nbl_18h06nov2023_0040.wav,5,N,[because of a is still other procesis to be followed]
sama_nbl_18h06nov2023_0041.wav,5.3,N,iplanti ehlwengisa emanzi iliphele [northern water] nomnyango wezamanzi nehlanzeko
sama_nbl_18h06nov2023_0042.wav,5.2,N,ngale kwalokho uyosidosele umtato ku [zero eight six tripple zero three two seven eight zero eight six]
sama_nbl_18h08oct2022_0001.wav,5.7,N,qinteliswa kwegezi isebenza ngegezi imitjhini epompa amanzi eqinisekisa ukuthi
sama_nbl_18h08oct2022_0003.wav,4.8,N,nesingalinyaziko nakancani kusasa ukhona mntwana nombuzmen ngizabe nginje
sama_nbl_18h08oct2022_0004.wav,11.4,N,umengameli we a_n_c u [cyril] ramaphosa uthembisa izakhamuzi ze [welkom] ukuthi ihlanganwakhe izakuragela phambili ngokulwa nekohlakalo eyenziwa makhansela nokufumbathisana ehlanganweni
sama_nbl_18h08oct2022_0005.wav,4.8,N,kodwana balila ngokuthi akhange bamukeleke kuhle begodu basahlelwa
sama_nbl_18h08oct2022_0006.wav,5.2,N,kuneendawo zedorobho ezinganamanzi ngemva kokwehla kwamazinga wamanzi emadamini okwenziwe ku
sama_nbl_18h08oct2022_0007.wav,8.6,N,uramaphosa  bekakhulume e [free state] ejimeni lelitsima uramaphosa uthembise nokuthi zizokutjhejwa iinlilo zomphakathi zokungaphakelwa iinsiza
sama_nbl_18h08oct2022_0010.wav,7.4,N,namhlanje umrero umemezele amalunga wekomitakhe ngemva kokukhutjhwa kwakaphalatse iveke ephelileko evowudini yokungasamthembi
sama_nbl_18h08oct2022_0011.wav,5.6,N,mlaleli wekwekwezi f_m asikvuse ksasa ekseni ngesimbi yesihlanu 
sama_nbl_18h08oct2022_0012.wav,6.8,N,sizibeka la zesimbili yesithandathu bezifundwa ngunokthula mtsgweni kukwekwezi f_m kukhanya bha ngyabuya nezesimbi yekhomba
sama_nbl_18h08oct2022_0013.wav,10.9,N,uthi amakhamera azokusiza khulu ukuqinisekisa ukuphepha kwabathengi namabhizinisi [one of our priorities really was to ensure we regenarate our major urban centers]
sama_nbl_18h08oct2022_0014.wav,4.9,N,usebenzisana nekoro yezamabhizinisi ukufaka amakhamera we cctv
sama_nbl_18h08oct2022_0015.wav,6.7,N,ayokwelusa ubulelesi edorobheni loke igadangweli lenziwe njengoba burhagele ubulelesi edorobheneli umbhele
sama_nbl_18h08oct2022_0016.wav,7.3,N,alehli khulu izinga lamanzi emadamini umurero ukhulume lokhu ngesikhathi amemezela iinkhulu zekomitakhe etja
sama_nbl_18h08oct2022_0017.wav,4.7,N,batjhiye iinarha zabo bazokufuna amadlelo ahlaza ekhethwapha
sama_nbl_18h08oct2022_0019.wav,9.3,N,ukukhitjhwa kwakhe kuqede umbuso ohlanganyelweko uphalatse uthi unethemba lokuthi bazolithumba icala loklila ngekambiso elandelweko nakukhethwa imeyara etja
sama_nbl_18h08oct2022_0021.wav,8.2,N,usazokbuya azokuhlola ukuthi zifakiwe na iindlwana ezitja ezimakhulu alikhomba namatjhumi amabili nanye
sama_nbl_18h08oct2022_0022.wav,5.8,N,umphathi wedorobha lethekwini umusa mbhele uthi umaspalada wethekweni
sama_nbl_18h08oct2022_0023.wav,6.5,N,ahlalela evalweni amaphandle anamabhizinisi epumalanga kapa ngebanga leenlelesi eziqothela amabhizinisabo
sama_nbl_18h08oct2022_0025.wav,8.9,N,nedlozi hlangana ya no izwakele sifikele ngemaphethelweni wehlelo mlaleli wekwekwezi f_m sithokoza kangangani indlebakho 
sama_nbl_18h08oct2022_0026.wav,5.7,N,eh naksasa ungalahli umrhatjho ukhula nje ukhuliswa lisekelo lakho laqobe malanga
sama_nbl_18h08oct2022_0027.wav,8,N,kuthiwa ayathunjwa abulawe abanjwe ikunzi amanye adlelezelwe iinkoloyi amaphandle afuna ukuvikelwa ngabezomthetho njengoba
sama_nbl_18h08oct2022_0028.wav,7.6,N,livusa abaleleko bona ngendlela isiqhema esidlala ngakhona ukuthi kunomukghwa nyana okhona kunedlozi eh
sama_nbl_18h08oct2022_0029.wav,6.2,N,ihlelo silisukumisa ngomdlalo kuyabuthelelwa amapuzu ibanyana ibethiwe e [australia] ne
sama_nbl_18h08oct2022_0030.wav,6.9,N,meyara ye [johannesburg] utato murero uthi kuyofika umvulo sewuphelile umraro wamanzi edrobheneli
sama_nbl_18h09jul2023_0001.wav,7.6,N,umengameli wehlangano ye a_n_c u [cyril] ramaphosa uthi ihlangano le yenze litho likhulu
sama_nbl_18h09jul2023_0004.wav,6.2,N,uthe lokhu kutlhogeka khulu lokhya aborhulumende beendawo nabangamandla afaneleko
sama_nbl_18h09jul2023_0006.wav,9.2,N,epumalanga yejwanisbhege umengameli uramaphosa uthi ihlangano ebusako isebenza njengomtjhini ofakwe kuhle i oli
sama_nbl_18h09jul2023_0011.wav,6.9,N,phambili namhlanje ngamasa isehlakalwesi sezenzeka endleleni ekulu i [n three vandrien] 
sama_nbl_18h09jul2023_0012.wav,5.4,N,ukusahlelwa amapholisa sekabuthile endleleni
sama_nbl_18h09jul2023_0014.wav,7.2,N,ikwekwezi f_m kukhanya iindaba ngeze awa lesithandathu 
sama_nbl_18h09jul2023_0015.wav,9.4,N,ekuqinisekiseni ibumbano nokuvuselela ihlangano njengombana kwaphakanyiswa emhlanganweni wayo omkhulu umnyaka odlulileko
sama_nbl_18h09jul2023_0016.wav,5.9,N,nelothe lisahlele endaweni leya [unfotunately this morning we had a]
sama_nbl_18h10dec2023_0001.wav,8.1,N,ekuyi amco ngokurhunyeziweko emzameni wokusombulula ubujamo obukhona ngalesi sikhathi wokubetha isthabalala emgodini
sama_nbl_18h10dec2023_0002.wav,8.6,N,samavowudi amanengi epalamende ngemva kokuthumba amakhetho wokuvala iinkhundla la ihlangano engekulu ephikisako
sama_nbl_18h10dec2023_0003.wav,5.4,N,lotjhani sitjhaba sekhethu indaba ekhamba phambili ngaleli awa yindaba ethi
sama_nbl_18h10dec2023_0004.wav,6.8,N,mihlanu imzuzu ngemva kwesimbi yesithandathu angsale sengizibamba la zangaleli iindaba
sama_nbl_18h10dec2023_0005.wav,8.3,N,njengombana ke sisenza kwemhleni asithome ke samukele isithekeli sethu sokuthoma silotjhise
sama_nbl_18h10dec2023_0008.wav,8.8,N,i ofisi lobujamo bezulu lithi kulindeleke ukusahlela kwezulu elina ngamandla kuthoma namhlanje kufikela ekuthomeni kweveke ezako le
sama_nbl_18h10dec2023_0009.wav,6.1,N,lithabo lodwa phezu kwakho ngiyazbongela madoda iye khona ningthomele lona kamnandi nokurnarha 
sama_nbl_18h10dec2023_0010.wav,8,N,ebaqotjhwe ngemva kokubanjwa kwehlelo lokukhalima mayelana nesehlakalo sangosewula sokubetha isithabalala emgodini emayini
sama_nbl_18h10dec2023_0011.wav,8.8,N,[free state gauteng] mpumalanga limpopo nesakwazulu natal nelinga letha ubungozi bokusahlela kweenkhukhula
sama_nbl_18h10dec2023_0012.wav,5.7,N,yihlangano ebusako enarheni yezimbabwe sekseduze khulu ukuthi uthole isilinganiso esifunekako
sama_nbl_18h10dec2023_0013.wav,5.8,N,namhlanje kuphume isebenzi esisodwa kwaphela ngemgodini [and using very poor health]
sama_nbl_18h10dec2023_0014.wav,4.7,N,bangathomi balinge ukuyama imlambo neendawo esele zigcwele amanzi
sama_nbl_18h10dec2023_0015.wav,5.5,N,akphathe kuhle uthi ngithi akphathe kuhle enze zona
